{
  "$schema": "https://json-schema.org/draft/2020-12/schema",
  "$id": "https://raw.githubusercontent.com/marty-protocol/marty-protocol/main/schemas/issuer-entity.json",
  "title": "IssuerEntity",
  "description": "An organisation or authority that issues credentials. Separate from Trust Anchors (cryptographic roots). An issuer may be backed by one or more trust anchors. Supports full lifecycle: accreditation, suspension, and revocation.",
  "type": "object",
  "required": ["id", "issuer_id", "issuer_type", "display_name", "is_system_issuer", "compliance_status", "accreditations", "valid_from", "metadata", "created_at", "updated_at"],
  "additionalProperties": false,
  "properties": {
    "id": {"type": "string", "format": "uuid"},
    "organization_id": {
      "type": ["string", "null"],
      "format": "uuid",
      "description": "null = global/system issuer (auto-visible to all organisations)"
    },
    "issuer_id": {
      "type": "string",
      "minLength": 1,
      "maxLength": 512,
      "description": "Unique issuer identifier: DID, domain, X.509 subject DN, or custom ID"
    },
    "issuer_type": {
      "type": "string",
      "enum": ["ORGANIZATION", "GOVERNMENT", "DEVICE"],
      "description": "ORGANIZATION: enterprise issuer. GOVERNMENT: state/national authority. DEVICE: device-bound credential issuer."
    },
    "display_name": {"type": "string", "minLength": 1, "maxLength": 256},
    "description": {"type": "string", "maxLength": 1024},
    "is_system_issuer": {
      "type": "boolean",
      "default": false,
      "description": "true = automatically visible to all organisations (e.g. ICAO-enrolled states, AAMVA issuers)"
    },
    "compliance_status": {
      "type": "string",
      "enum": ["ACCREDITED", "COMPLIANT", "SUSPENDED", "REVOKED"],
      "description": "ACCREDITED: formally certified by an accreditation body. COMPLIANT: meets required standards. SUSPENDED: temporarily inactive (reversible). REVOKED: permanently invalidated."
    },
    "accreditation_body": {
      "type": ["string", "null"],
      "maxLength": 256,
      "description": "The authority that certified the issuer; this is not evidence of which accreditations the issuer holds."
    },
    "accreditations": {
      "type": "array",
      "description": "Accreditation identifiers held by this issuer. Policy comparison is case-insensitive and requires every requested identifier.",
      "items": {"type": "string", "minLength": 1, "maxLength": 128},
      "maxItems": 64,
      "uniqueItems": true
    },
    "accreditation_date": {"type": ["string", "null"], "format": "date-time"},
    "valid_from": {"type": "string", "format": "date-time"},
    "valid_until": {"type": ["string", "null"], "format": "date-time", "description": "null = indefinite validity"},
    "trust_anchor_id": {
      "type": ["string", "null"],
      "format": "uuid",
      "description": "Optional link to a trust anchor (for X.509 chain-backed issuers)"
    },
    "revoked_at": {"type": ["string", "null"], "format": "date-time"},
    "revocation_reason": {"type": ["string", "null"], "maxLength": 512},
    "revoked_by": {"type": ["string", "null"], "maxLength": 256},
    "metadata": {"$ref": "#/$defs/publicMetadata"},
    "created_at": {"type": "string", "format": "date-time"},
    "updated_at": {"type": "string", "format": "date-time"}
  },
  "$defs": {
    "publicMetadata": {
      "type": "object",
      "description": "Public descriptive metadata. Custody, key-routing, profile, KMS, and provider selectors are prohibited at every depth.",
      "propertyNames": {
        "not": {
          "enum": [
            "issuer_profile_id",
            "issuer_key_id",
            "issuer_algorithm",
            "key_access_mode",
            "key_binding",
            "key_management",
            "verification_method_id",
            "signing_service_id",
            "signing_key_reference",
            "key_reference",
            "kms_arn",
            "kms_provider",
            "kms_region",
            "managed_key_id",
            "provider",
            "service_id",
            "signing_agent_auth",
            "signing_agent_url",
            "key_name",
            "key_version",
            "transit_mount"
          ]
        }
      },
      "additionalProperties": {"$ref": "#/$defs/publicMetadataValue"}
    },
    "publicMetadataValue": {
      "anyOf": [
        {"type": ["string", "number", "boolean", "null"]},
        {
          "type": "array",
          "items": {"$ref": "#/$defs/publicMetadataValue"}
        },
        {"$ref": "#/$defs/publicMetadata"}
      ]
    }
  }
}
