{
  "id": "a1b2c3d4-e5f6-4789-abcd-ef0123456789",
  "issuer_id": "did:web:issuer.example.com",
  "issuer_type": "ORGANIZATION",
  "display_name": "Example Corp Credential Issuer",
  "compliance_status": "ACCREDITED",
  "valid_from": "2025-01-01T00:00:00Z",
  "valid_until": "2027-12-31T23:59:59Z",
  "organization_id": "f0e1d2c3-b4a5-4968-7890-123456789abc",
  "description": "Enterprise credential issuer for employee badges",
  "is_system_issuer": false,
  "accreditation_body": "National Identity Authority",
  "accreditations": ["ISO27001", "FIPS140-2"],
  "accreditation_date": "2025-01-01T00:00:00Z",
  "trust_anchor_id": "b2c3d4e5-f6a7-4890-bcde-f01234567890",
  "revoked_at": null,
  "revocation_reason": null,
  "revoked_by": null,
  "metadata": {},
  "created_at": "2025-01-01T00:00:00Z",
  "updated_at": "2025-06-15T12:00:00Z"
}
